{"$schema":"https://json-schema.org/draft/2020-12/schema","$id":"https://axignal.com/schemas/connector-sdk-registry.schema.json","title":"AXIGNAL Connector SDK Registry","type":"object","additionalProperties":false,"required":["schema_version","task_id","programme_version","status","human_authorised_branch_start","canonical_activation_authorised","dependency_status","trust_principles","sdk_contract","source_profile_contract","admission_pipeline","lifecycle_contract","quality_contract","outage_contract","revocation_contract","security_contract","reference_profiles","conformance_suite","observability","acceptance_gate"],"properties":{"schema_version":{"const":"axignal.connector-sdk-registry/v0.1"},"task_id":{"const":"AX-GE2E-P04-T01"},"programme_version":{"const":"1.4.0"},"status":{"const":"DRAFT_ENGINEERING_FOUNDATION"},"human_authorised_branch_start":{"const":true},"canonical_activation_authorised":{"const":false},"dependency_status":{"type":"object","additionalProperties":false,"required":["p03_task","p03_engineering_head","p03_engineering_evidence_ready","p03_canonical_activation_authorised","p02_canonical_activation_authorised","p01_dependency_satisfied","stacked_base_branch","merge_to_main_allowed"],"properties":{"p03_task":{"const":"AX-GE2E-P03-T01"},"p03_engineering_head":{"pattern":"^[0-9a-f]{40}$"},"p03_engineering_evidence_ready":{"const":true},"p03_canonical_activation_authorised":{"const":false},"p02_canonical_activation_authorised":{"const":false},"p01_dependency_satisfied":{"const":false},"stacked_base_branch":{"const":"agent/ax-ge2e-p03-security-identity-rights-v1.4"},"merge_to_main_allowed":{"const":false}}},"trust_principles":{"type":"array","minItems":12,"uniqueItems":true,"items":{"type":"string","minLength":20}},"sdk_contract":{"type":"object","additionalProperties":false,"required":["sdk_version","package_layout","adapter_methods","candidate_outputs","forbidden_outputs","authority_ceiling","determinism_requirements"],"properties":{"sdk_version":{"const":"0.1.0"},"package_layout":{"type":"array","minItems":8,"uniqueItems":true,"items":{"type":"string"}},"adapter_methods":{"type":"array","minItems":12,"maxItems":12,"uniqueItems":true,"items":{"type":"string","pattern":"^[a-z][a-z0-9_]+$"}},"candidate_outputs":{"type":"array","minItems":5,"uniqueItems":true,"items":{"type":"string"}},"forbidden_outputs":{"type":"array","minItems":5,"uniqueItems":true,"items":{"type":"string"}},"authority_ceiling":{"type":"object","minProperties":7,"additionalProperties":{"const":false}},"determinism_requirements":{"type":"array","minItems":8,"uniqueItems":true,"items":{"type":"string"}}}},"source_profile_contract":{"type":"object","additionalProperties":false,"required":["required_fields","rights_dimensions","legal_authority_states","personal_data_policies","content_modes","rules"],"properties":{"required_fields":{"type":"array","minItems":25,"uniqueItems":true,"items":{"type":"string"}},"rights_dimensions":{"type":"array","minItems":10,"maxItems":10,"uniqueItems":true,"items":{"type":"string"}},"legal_authority_states":{"type":"array","minItems":6,"uniqueItems":true,"items":{"type":"string"}},"personal_data_policies":{"type":"array","minItems":4,"uniqueItems":true,"items":{"type":"string"}},"content_modes":{"type":"array","minItems":4,"uniqueItems":true,"items":{"type":"string"}},"rules":{"type":"array","minItems":5,"uniqueItems":true,"items":{"type":"string"}}}},"admission_pipeline":{"type":"object","additionalProperties":false,"required":["stages","gate_catalog","decision_states","default_decision","rules"],"properties":{"stages":{"type":"array","minItems":7,"maxItems":7,"uniqueItems":true,"items":{"type":"object","additionalProperties":false,"required":["stage_id","input","output","required_gate_ids"],"properties":{"stage_id":{"pattern":"^S[0-9]{2}_[A-Z_]+$"},"input":{"type":"string"},"output":{"type":"string"},"required_gate_ids":{"type":"array","minItems":1,"uniqueItems":true,"items":{"pattern":"^G[0-9]{2}_[A-Z_]+$"}}}}},"gate_catalog":{"type":"array","minItems":16,"maxItems":16,"items":{"type":"object","additionalProperties":false,"required":["gate_id","domain","required_evidence","pass_state","fail_state","human_authority_required"],"properties":{"gate_id":{"pattern":"^G[0-9]{2}_[A-Z_]+$"},"domain":{"type":"string"},"required_evidence":{"type":"array","minItems":3,"uniqueItems":true,"items":{"type":"string"}},"pass_state":{"const":"PASS"},"fail_state":{"enum":["DENY","QUARANTINE","SUSPEND"]},"human_authority_required":{"type":"boolean"}}}},"decision_states":{"type":"array","contains":{"const":"INDETERMINATE"},"uniqueItems":true,"items":{"type":"string"}},"default_decision":{"const":"DENY"},"rules":{"type":"array","minItems":5,"items":{"type":"string"}}}},"lifecycle_contract":{"type":"object","additionalProperties":false,"required":["states","allowed_transitions","rules"],"properties":{"states":{"type":"array","minItems":7,"maxItems":7,"uniqueItems":true,"items":{"type":"string"}},"allowed_transitions":{"type":"array","minItems":10,"uniqueItems":true,"items":{"pattern":"^[A-Z_]+->[A-Z_]+$"}},"rules":{"type":"array","minItems":4,"items":{"type":"string"}}}},"quality_contract":{"$ref":"#/$defs/rules_contract"},"outage_contract":{"type":"object","additionalProperties":false,"required":["states","controls","rules"],"properties":{"states":{"type":"array","minItems":5,"uniqueItems":true,"items":{"type":"string"}},"controls":{"type":"array","minItems":7,"uniqueItems":true,"items":{"type":"string"}},"rules":{"type":"array","minItems":4,"items":{"type":"string"}}}},"revocation_contract":{"type":"object","additionalProperties":false,"required":["triggers","required_actions","rules"],"properties":{"triggers":{"type":"array","minItems":8,"uniqueItems":true,"items":{"type":"string"}},"required_actions":{"type":"array","minItems":8,"uniqueItems":true,"items":{"type":"string"}},"rules":{"type":"array","minItems":3,"items":{"type":"string"}}}},"security_contract":{"type":"object","additionalProperties":false,"required":["network_controls","runtime_controls","rules"],"properties":{"network_controls":{"type":"array","minItems":7,"uniqueItems":true,"items":{"type":"string"}},"runtime_controls":{"type":"array","minItems":7,"uniqueItems":true,"items":{"type":"string"}},"rules":{"type":"array","minItems":4,"items":{"type":"string"}}}},"reference_profiles":{"type":"array","minItems":4,"maxItems":4,"items":{"type":"object","additionalProperties":false,"required":["profile_id","profile_kind","state","endpoint_origin","auth_mode","personal_data_policy","content_mode","rights_snapshot","admission_authorised"],"properties":{"profile_id":{"pattern":"^AX-SRC-REF-[A-Z0-9-]+$"},"profile_kind":{"const":"REFERENCE_ONLY"},"state":{"enum":["SANDBOX","SUSPENDED","REVOKED"]},"endpoint_origin":{"format":"uri","pattern":"^https://.*\\.example\\.invalid$"},"auth_mode":{"type":"string"},"personal_data_policy":{"type":"string"},"content_mode":{"type":"string"},"rights_snapshot":{"type":"object","minProperties":10,"maxProperties":10,"additionalProperties":{"enum":["ALLOW","DENY","REVIEW_REQUIRED"]}},"admission_authorised":{"const":false}}}},"conformance_suite":{"type":"object","additionalProperties":false,"required":["required_suites","minimum_fixture_classes"],"properties":{"required_suites":{"type":"array","minItems":16,"uniqueItems":true,"items":{"type":"string"}},"minimum_fixture_classes":{"type":"array","minItems":12,"uniqueItems":true,"items":{"type":"string"}}}},"observability":{"type":"object","additionalProperties":false,"required":["metrics","alerts"],"properties":{"metrics":{"type":"array","minItems":10,"uniqueItems":true,"items":{"type":"string"}},"alerts":{"type":"array","minItems":10,"uniqueItems":true,"items":{"type":"string"}}}},"acceptance_gate":{"type":"object","additionalProperties":false,"required":["required_before_canonical_activation","current_decision"],"properties":{"required_before_canonical_activation":{"type":"array","minItems":12,"uniqueItems":true,"items":{"type":"string"}},"current_decision":{"const":"NOT_READY_FOR_CANONICAL_ACTIVATION"}}}},"$defs":{"rules_contract":{"type":"object","required":["dimensions","rules"],"additionalProperties":false,"properties":{"dimensions":{"type":"array","minItems":7,"uniqueItems":true,"items":{"type":"string"}},"rules":{"type":"array","minItems":4,"items":{"type":"string"}}}}}}