{"schema_version":"axignal.connector-sdk-registry/v0.1","task_id":"AX-GE2E-P04-T01","programme_version":"1.4.0","status":"DRAFT_ENGINEERING_FOUNDATION","human_authorised_branch_start":true,"canonical_activation_authorised":false,"dependency_status":{"p03_task":"AX-GE2E-P03-T01","p03_engineering_head":"3b950b1b111a0eb6e3b9b330cc15887db8699f3c","p03_engineering_evidence_ready":true,"p03_canonical_activation_authorised":false,"p02_canonical_activation_authorised":false,"p01_dependency_satisfied":false,"stacked_base_branch":"agent/ax-ge2e-p03-security-identity-rights-v1.4","merge_to_main_allowed":false},"trust_principles":["A connector is an untrusted data-plane adapter and has zero canonical admission authority.","Technical reachability never proves legal authority, rights, quality, privacy safety or product suitability.","Every source requires a versioned source profile and independently reviewable rights snapshot.","Unknown, stale, ambiguous, conflicting or revoked source authority fails closed.","Raw payloads are transient by default and persistence requires an explicit right and data-class decision.","Source-native values, identifiers, taxonomies and temporal ambiguity are preserved rather than silently repaired.","Connector output is limited to candidate source objects, candidate evidence and diagnostics.","Models may propose parsing or mappings but cannot approve rights, quality, admission, revocation or recovery.","All network destinations, redirects, authentication methods and payload bounds are declared and enforced.","Retries are bounded, idempotent and subordinate to rate limits, budgets, circuit breakers and kill switches.","Outage, schema drift, quality regression and revocation change lifecycle state before new materialisation.","Deletion and revocation propagate through derived artifacts without erasing audit evidence.","A source reaches PRODUCT_ADMITTED only after separate security, rights and product approvals.","Every connector package must pass the same deterministic conformance suite before source-specific review."],"sdk_contract":{"sdk_version":"0.1.0","package_layout":["connector.yaml","source_profile.json","schemas/input.schema.json","schemas/normalized.schema.json","adapter.py","mappings/","fixtures/","tests/","README.md"],"adapter_methods":["describe_source","preflight","authenticate","healthcheck","fetch_page","parse_payload","normalize_records","classify_records","emit_candidate_objects","checkpoint","reconcile","revoke"],"candidate_outputs":["CandidateSourceObject","CandidateEvidenceObject","CandidateClaim","ConnectorDiagnostic","Checkpoint","DeletionTombstone"],"forbidden_outputs":["CanonicalSourceAdmission","AdmittedEvidence","CanonicalClaim","RoleBinding","RightsApproval","ExportApproval"],"authority_ceiling":{"canonical_source_admission":false,"canonical_evidence_admission":false,"canonical_claim_admission":false,"rights_inference_or_approval":false,"security_policy_mutation":false,"tenant_or_workspace_selection":false,"model_direct_admission":false},"determinism_requirements":["Pinned connector, parser, schema and mapping versions.","Stable source-object keys and idempotency keys.","Content digests before parsing and after normalisation.","Explicit cursor and checkpoint semantics.","No implicit current time, locale, timezone or currency.","No undeclared network destination or redirect.","No unbounded recursion, archive expansion, pagination or retry.","Same fixture and version set yields byte-stable candidate objects."]},"source_profile_contract":{"required_fields":["source_id","source_version","profile_version","owner","jurisdictions","endpoint_origins","auth_mode","terms_snapshot","licence_snapshot","legal_basis","rights_snapshot","personal_data_policy","data_classification","content_mode","retention_policy","attribution_requirements","rate_limit","retry_budget","cost_budget","schema_versions","parser_version","mapping_versions","quality_thresholds","freshness_policy","outage_policy","revocation_policy","deletion_policy","kill_switch","observability","rollback"],"rights_dimensions":["collection","transient_processing","persistent_storage","model_input","derived_calculations","internal_display","customer_display","export","api_redistribution","model_training_or_evaluation"],"legal_authority_states":["UNREVIEWED","REVIEW_REQUIRED","APPROVED","REJECTED","EXPIRED","REVOKED"],"personal_data_policies":["PROHIBITED","MINIMISE","MINIMISE_AND_QUARANTINE","EXPLICITLY_APPROVED"],"content_modes":["NONE","METADATA_ONLY","TRANSIENT_PARSE_DERIVED_ONLY","FULL_CONTENT_EXPLICIT_RIGHT"],"rules":["Endpoint origins use exact scheme and host allowlists; wildcard origins are prohibited.","Credentials are secret references, never profile values, URLs, logs or candidate objects.","Rights decisions are per dimension and cannot be inferred from a general licence label.","A profile change invalidates prior preflight and admission decisions.","Reference profiles use example.invalid and cannot be treated as product-admitted sources."]},"admission_pipeline":{"stages":[{"stage_id":"S01_PROFILE","input":"connector_package","output":"source_profile","required_gate_ids":["G01_LEGAL_AUTHORITY","G02_RIGHTS_MATRIX"]},{"stage_id":"S02_PREFLIGHT","input":"source_profile","output":"preflight_record","required_gate_ids":["G03_PRIVACY_CLASSIFICATION","G04_SECURITY_PREFLIGHT","G11_RATE_AND_COST"]},{"stage_id":"S03_SANDBOX_FETCH","input":"preflight_record","output":"raw_transient_payload","required_gate_ids":["G12_OUTAGE_POLICY","G14_OBSERVABILITY"]},{"stage_id":"S04_PARSE_NORMALIZE","input":"raw_transient_payload","output":"normalized_candidate_records","required_gate_ids":["G05_PROVENANCE","G06_SCHEMA_CONFORMANCE","G08_TEMPORAL_SEMANTICS","G09_TAXONOMY_MAPPING"]},{"stage_id":"S05_QUALITY_RECONCILE","input":"normalized_candidate_records","output":"quality_report","required_gate_ids":["G07_QUALITY_THRESHOLDS","G10_IDEMPOTENCY"]},{"stage_id":"S06_CANDIDATE_HANDOFF","input":"quality_report","output":"candidate_source_objects","required_gate_ids":["G13_REVOCATION_AND_DELETION","G15_ROLLBACK"]},{"stage_id":"S07_HUMAN_ADMISSION","input":"candidate_source_objects","output":"admission_decision","required_gate_ids":["G16_HUMAN_ADMISSION"]}],"gate_catalog":[{"gate_id":"G01_LEGAL_AUTHORITY","domain":"LEGAL","required_evidence":["terms_snapshot","licence_snapshot","legal_basis","jurisdiction"],"pass_state":"PASS","fail_state":"DENY","human_authority_required":true},{"gate_id":"G02_RIGHTS_MATRIX","domain":"DATA_RIGHTS","required_evidence":["rights_snapshot","permitted_uses","attribution","retention"],"pass_state":"PASS","fail_state":"DENY","human_authority_required":true},{"gate_id":"G03_PRIVACY_CLASSIFICATION","domain":"PRIVACY","required_evidence":["personal_data_assessment","classification_profile","purpose"],"pass_state":"PASS","fail_state":"QUARANTINE","human_authority_required":true},{"gate_id":"G04_SECURITY_PREFLIGHT","domain":"SECURITY","required_evidence":["endpoint_allowlist","auth_method","secret_handling","sandbox_policy"],"pass_state":"PASS","fail_state":"DENY","human_authority_required":false},{"gate_id":"G05_PROVENANCE","domain":"EPISTEMIC","required_evidence":["source_identity","source_version","retrieval_time","content_digest"],"pass_state":"PASS","fail_state":"QUARANTINE","human_authority_required":false},{"gate_id":"G06_SCHEMA_CONFORMANCE","domain":"QUALITY","required_evidence":["input_schema","parser_version","normalized_schema"],"pass_state":"PASS","fail_state":"QUARANTINE","human_authority_required":false},{"gate_id":"G07_QUALITY_THRESHOLDS","domain":"QUALITY","required_evidence":["completeness","validity","consistency","duplicate_rate"],"pass_state":"PASS","fail_state":"SUSPEND","human_authority_required":false},{"gate_id":"G08_TEMPORAL_SEMANTICS","domain":"EPISTEMIC","required_evidence":["source_timezone","observed_at","effective_at","published_at"],"pass_state":"PASS","fail_state":"QUARANTINE","human_authority_required":false},{"gate_id":"G09_TAXONOMY_MAPPING","domain":"EPISTEMIC","required_evidence":["source_native_taxonomy","crosswalk_version","unmapped_policy"],"pass_state":"PASS","fail_state":"QUARANTINE","human_authority_required":false},{"gate_id":"G10_IDEMPOTENCY","domain":"RELIABILITY","required_evidence":["source_object_key","cursor","deduplication_key","replay_policy"],"pass_state":"PASS","fail_state":"SUSPEND","human_authority_required":false},{"gate_id":"G11_RATE_AND_COST","domain":"OPERATIONS","required_evidence":["rate_limit","retry_budget","cost_budget","circuit_breaker"],"pass_state":"PASS","fail_state":"SUSPEND","human_authority_required":false},{"gate_id":"G12_OUTAGE_POLICY","domain":"OPERATIONS","required_evidence":["healthcheck","stale_read_policy","outage_state","recovery_probe"],"pass_state":"PASS","fail_state":"SUSPEND","human_authority_required":false},{"gate_id":"G13_REVOCATION_AND_DELETION","domain":"DATA_RIGHTS","required_evidence":["kill_switch","revocation_path","deletion_propagation","tombstone_policy"],"pass_state":"PASS","fail_state":"DENY","human_authority_required":true},{"gate_id":"G14_OBSERVABILITY","domain":"OPERATIONS","required_evidence":["metrics","structured_logs","trace_ids","alerts"],"pass_state":"PASS","fail_state":"SUSPEND","human_authority_required":false},{"gate_id":"G15_ROLLBACK","domain":"GOVERNANCE","required_evidence":["rollback_plan","checkpoint_restore","residual_scan"],"pass_state":"PASS","fail_state":"DENY","human_authority_required":false},{"gate_id":"G16_HUMAN_ADMISSION","domain":"GOVERNANCE","required_evidence":["security_approval","rights_approval","product_approval"],"pass_state":"PASS","fail_state":"DENY","human_authority_required":true}],"decision_states":["PASS","DENY","QUARANTINE","SUSPEND","NOT_APPLICABLE","INDETERMINATE"],"default_decision":"DENY","rules":["Every stage records immutable inputs, outputs, policy version and reason codes.","INDETERMINATE is treated as DENY.","A later gate cannot override a prior DENY or active kill switch.","Only